{
  "schema": "UnrealImport/1.0",
  "turn_id": "tt-run-003-5c9cbe9d",
  "source": {
    "geometry_log": [
      {
        "hive": "hive-b",
        "kind": "chamber",
        "coords": [
          9,
          1,
          0
        ],
        "at": "2026-08-14T01:11:45.842Z",
        "state_at_event": {
          "stockpile": {
            "wood": 0,
            "food": 0
          },
          "tile_id": "tile-19",
          "coords": [
            9,
            1,
            0
          ],
          "resource_depleted": true
        },
        "schema_name": "ant-hive-world.geometry-event",
        "schema_version": "1.0.0",
        "run_id": "5c9cbe9d-3a15-4051-b622-c70bf8c610e3",
        "episode_id": "3ba1594e-ee8e-4786-bc5c-bd8ff0a0043e",
        "arm_id": "uninstructed",
        "tick": 7,
        "tick_key": "3ba1594e-ee8e-4786-bc5c-bd8ff0a0043e:7:hive-b"
      },
      {
        "hive": "hive-a",
        "kind": "chamber",
        "coords": [
          3,
          1,
          0
        ],
        "at": "2026-08-14T01:11:45.855Z",
        "state_at_event": {
          "stockpile": {
            "food": 0,
            "wood": 1
          },
          "tile_id": "tile-13",
          "coords": [
            3,
            1,
            0
          ],
          "resource_depleted": false
        },
        "schema_name": "ant-hive-world.geometry-event",
        "schema_version": "1.0.0",
        "run_id": "5c9cbe9d-3a15-4051-b622-c70bf8c610e3",
        "episode_id": "3ba1594e-ee8e-4786-bc5c-bd8ff0a0043e",
        "arm_id": "uninstructed",
        "tick": 19,
        "tick_key": "3ba1594e-ee8e-4786-bc5c-bd8ff0a0043e:19:hive-a"
      },
      {
        "hive": "hive-b",
        "kind": "chamber",
        "coords": [
          2,
          6,
          0
        ],
        "at": "2026-08-14T01:11:45.865Z",
        "state_at_event": {
          "stockpile": {
            "wood": 2,
            "food": 0
          },
          "tile_id": "tile-62",
          "coords": [
            2,
            6,
            0
          ],
          "resource_depleted": false
        },
        "schema_name": "ant-hive-world.geometry-event",
        "schema_version": "1.0.0",
        "run_id": "5c9cbe9d-3a15-4051-b622-c70bf8c610e3",
        "episode_id": "3ba1594e-ee8e-4786-bc5c-bd8ff0a0043e",
        "arm_id": "uninstructed",
        "tick": 27,
        "tick_key": "3ba1594e-ee8e-4786-bc5c-bd8ff0a0043e:27:hive-b"
      },
      {
        "hive": "hive-a",
        "kind": "chamber",
        "coords": [
          7,
          9,
          0
        ],
        "at": "2026-08-14T01:11:45.867Z",
        "state_at_event": {
          "stockpile": {
            "food": 0,
            "wood": 0
          },
          "tile_id": "tile-97",
          "coords": [
            7,
            9,
            0
          ],
          "resource_depleted": true
        },
        "schema_name": "ant-hive-world.geometry-event",
        "schema_version": "1.0.0",
        "run_id": "5c9cbe9d-3a15-4051-b622-c70bf8c610e3",
        "episode_id": "3ba1594e-ee8e-4786-bc5c-bd8ff0a0043e",
        "arm_id": "uninstructed",
        "tick": 29,
        "tick_key": "3ba1594e-ee8e-4786-bc5c-bd8ff0a0043e:29:hive-a"
      },
      {
        "hive": "hive-b",
        "kind": "chamber",
        "coords": [
          4,
          3,
          0
        ],
        "at": "2026-08-14T01:11:45.868Z",
        "state_at_event": {
          "stockpile": {
            "wood": 1,
            "food": 0
          },
          "tile_id": "tile-34",
          "coords": [
            4,
            3,
            0
          ],
          "resource_depleted": false
        },
        "schema_name": "ant-hive-world.geometry-event",
        "schema_version": "1.0.0",
        "run_id": "5c9cbe9d-3a15-4051-b622-c70bf8c610e3",
        "episode_id": "3ba1594e-ee8e-4786-bc5c-bd8ff0a0043e",
        "arm_id": "uninstructed",
        "tick": 30,
        "tick_key": "3ba1594e-ee8e-4786-bc5c-bd8ff0a0043e:30:hive-b"
      },
      {
        "hive": "hive-b",
        "kind": "chamber",
        "coords": [
          5,
          3,
          0
        ],
        "at": "2026-08-14T01:11:45.878Z",
        "state_at_event": {
          "stockpile": {
            "wood": 1,
            "food": 0
          },
          "tile_id": "tile-35",
          "coords": [
            5,
            3,
            0
          ],
          "resource_depleted": false
        },
        "schema_name": "ant-hive-world.geometry-event",
        "schema_version": "1.0.0",
        "run_id": "5c9cbe9d-3a15-4051-b622-c70bf8c610e3",
        "episode_id": "3ba1594e-ee8e-4786-bc5c-bd8ff0a0043e",
        "arm_id": "uninstructed",
        "tick": 39,
        "tick_key": "3ba1594e-ee8e-4786-bc5c-bd8ff0a0043e:39:hive-b"
      },
      {
        "hive": "hive-b",
        "kind": "chamber",
        "coords": [
          3,
          6,
          0
        ],
        "at": "2026-08-14T01:11:45.882Z",
        "state_at_event": {
          "stockpile": {
            "wood": 0,
            "food": 0
          },
          "tile_id": "tile-63",
          "coords": [
            3,
            6,
            0
          ],
          "resource_depleted": true
        },
        "schema_name": "ant-hive-world.geometry-event",
        "schema_version": "1.0.0",
        "run_id": "5c9cbe9d-3a15-4051-b622-c70bf8c610e3",
        "episode_id": "3ba1594e-ee8e-4786-bc5c-bd8ff0a0043e",
        "arm_id": "uninstructed",
        "tick": 43,
        "tick_key": "3ba1594e-ee8e-4786-bc5c-bd8ff0a0043e:43:hive-b"
      },
      {
        "hive": "hive-a",
        "kind": "chamber",
        "coords": [
          2,
          2,
          0
        ],
        "at": "2026-08-14T01:11:45.885Z",
        "state_at_event": {
          "stockpile": {
            "food": 0,
            "wood": 1
          },
          "tile_id": "tile-22",
          "coords": [
            2,
            2,
            0
          ],
          "resource_depleted": false
        },
        "schema_name": "ant-hive-world.geometry-event",
        "schema_version": "1.0.0",
        "run_id": "5c9cbe9d-3a15-4051-b622-c70bf8c610e3",
        "episode_id": "3ba1594e-ee8e-4786-bc5c-bd8ff0a0043e",
        "arm_id": "uninstructed",
        "tick": 46,
        "tick_key": "3ba1594e-ee8e-4786-bc5c-bd8ff0a0043e:46:hive-a"
      },
      {
        "hive": "hive-a",
        "kind": "chamber",
        "coords": [
          1,
          3,
          0
        ],
        "at": "2026-08-14T01:11:45.897Z",
        "state_at_event": {
          "stockpile": {
            "food": 0,
            "wood": 0
          },
          "tile_id": "tile-31",
          "coords": [
            1,
            3,
            0
          ],
          "resource_depleted": true
        },
        "schema_name": "ant-hive-world.geometry-event",
        "schema_version": "1.0.0",
        "run_id": "5c9cbe9d-3a15-4051-b622-c70bf8c610e3",
        "episode_id": "3ba1594e-ee8e-4786-bc5c-bd8ff0a0043e",
        "arm_id": "uninstructed",
        "tick": 57,
        "tick_key": "3ba1594e-ee8e-4786-bc5c-bd8ff0a0043e:57:hive-a"
      },
      {
        "hive": "hive-b",
        "kind": "chamber",
        "coords": [
          2,
          5,
          0
        ],
        "at": "2026-08-14T01:11:45.897Z",
        "state_at_event": {
          "stockpile": {
            "wood": 1,
            "food": 1
          },
          "tile_id": "tile-52",
          "coords": [
            2,
            5,
            0
          ],
          "resource_depleted": false
        },
        "schema_name": "ant-hive-world.geometry-event",
        "schema_version": "1.0.0",
        "run_id": "5c9cbe9d-3a15-4051-b622-c70bf8c610e3",
        "episode_id": "3ba1594e-ee8e-4786-bc5c-bd8ff0a0043e",
        "arm_id": "uninstructed",
        "tick": 57,
        "tick_key": "3ba1594e-ee8e-4786-bc5c-bd8ff0a0043e:57:hive-b"
      },
      {
        "hive": "hive-b",
        "kind": "chamber",
        "coords": [
          4,
          9,
          0
        ],
        "at": "2026-08-14T01:11:45.901Z",
        "state_at_event": {
          "stockpile": {
            "wood": 0,
            "food": 0
          },
          "tile_id": "tile-94",
          "coords": [
            4,
            9,
            0
          ],
          "resource_depleted": true
        },
        "schema_name": "ant-hive-world.geometry-event",
        "schema_version": "1.0.0",
        "run_id": "5c9cbe9d-3a15-4051-b622-c70bf8c610e3",
        "episode_id": "3ba1594e-ee8e-4786-bc5c-bd8ff0a0043e",
        "arm_id": "uninstructed",
        "tick": 60,
        "tick_key": "3ba1594e-ee8e-4786-bc5c-bd8ff0a0043e:60:hive-b"
      },
      {
        "hive": "hive-a",
        "kind": "chamber",
        "coords": [
          6,
          1,
          0
        ],
        "at": "2026-08-14T01:11:45.905Z",
        "state_at_event": {
          "stockpile": {
            "food": 0,
            "wood": 0
          },
          "tile_id": "tile-16",
          "coords": [
            6,
            1,
            0
          ],
          "resource_depleted": true
        },
        "schema_name": "ant-hive-world.geometry-event",
        "schema_version": "1.0.0",
        "run_id": "5c9cbe9d-3a15-4051-b622-c70bf8c610e3",
        "episode_id": "3ba1594e-ee8e-4786-bc5c-bd8ff0a0043e",
        "arm_id": "uninstructed",
        "tick": 64,
        "tick_key": "3ba1594e-ee8e-4786-bc5c-bd8ff0a0043e:64:hive-a"
      },
      {
        "hive": "hive-b",
        "kind": "chamber",
        "coords": [
          9,
          6,
          0
        ],
        "at": "2026-08-14T01:11:45.910Z",
        "state_at_event": {
          "stockpile": {
            "wood": 0,
            "food": 0
          },
          "tile_id": "tile-69",
          "coords": [
            9,
            6,
            0
          ],
          "resource_depleted": true
        },